name,image,description
Einfach & Aktuell Thema,https://einfachebuecher.de/media/63/c4/c0/1689766112/Hitze_Titelbild.jpg,"Abonnieren Sie Einfach & Aktuell Thema: Unsere digitalen Themenhefte  Spannende Themen  - Jede Woche in Einfacher Sprache zusammengefasst! Die Einfach & Aktuell Thema bieten die Möglichkeit, tiefer in ein Themenfeld einzutauchen. Die spannenden Artikel der Themenhefte werden durch Aufgaben ergänzt, die das Leseverständnis unterstützen. Dadurch ist die ​Einfach & Aktuell Thema sehr gut für den Einsatz im Unterricht geeignet. Jede Woche gibt es ein neues spannendes Thema zu entdecken! Alle Ausgaben werden in ein Themen-Archiv eingefügt, das Ihnen immer zur Verfügung steht. So haben Lehrkräfte für die nächste Unterrichtsreihe direkt das passende Themenheft parat.  Die Einfach & Aktuell Thema erscheint wöchentlich montags. Eine kostenlose Probeausgabe finden Sie hier.  PreiseBis Ende des Jahres 2023 ist die Einfach & Aktuell Thema in einem Sonderangebot für € 99 als Abo erhältlich.  Dabei erhalten Sie: 16 Ausgaben bis Ende 2023eine Ausgabe pro Wochespannende Einblicke in verschiedenste Themen Zugriff auf unser Themenarchiv  Ab 2024 ist die Einfach & Aktuell Thema zu einem Preis von € 319 im Jahres-Abo erhältlich (40 Ausgaben pro Jahr).  Für Kundinnen und Kunden, die bereits die Einfach & Aktuell erhalten, gibt es zudem ein Kombiangebot: Beide Zeitungen für €499 im Jahres-Abo. Dieses Angebot ist ab dem 01.01.2024 verfügbar.  Dauer des AbonnementsIhr Abo für die Einfach & Aktuell Thema läuft nach Abschluss bis Ende des Jahres 2023. Das Probeabonnement verlängert sich nicht automatisch. Abweichende Laufzeiten können schriftlich vereinbart werden. Schreiben Sie uns in diesem Fall bitte eine Mail. Preiserhöhung Angegeben ist der aktuell gültige Preis. Bei Abschluss eines Abos ist dieser bis Ende des Jahres festgeschrieben. Der Verlag ist ab 2025 berechtigt, den Preis um maximal 10 Prozent pro Jahr zu erhöhen ohne den Kunden zu informieren und ohne, dass daraus ein Sonderkündigungsrecht entsteht."
Einmal Schnitzel mit Buch,https://einfachebuecher.de/media/e7/5f/3b/1654876228/Einmal_Schnitzel_mit_buch_cover_digital_lowres_m.jpg,"Acht Kurzgeschichten über acht verschiedene Lebens-Schicksale:
Eine Köchin verliert plötzlich ihre Arbeit und hat eine verrückte Idee.
Ein junger Mann muss um Leben und Tod kämpfen.
Eine Frau gerät im Schwimmbad in eine äußerst peinliche Situation.
Paula wird wegen einer anderen von ihrem Mann verlassen.
Lisa Möller soll eine lebensgefährliche Entscheidung treffen.
Johanna will ihr Volk retten.
Und eine Frau erlebt auf einer Insel seltsame Vorfälle.
 
Plötzlich verändert sich das Gesicht von Jürgen Müller.
Er sagt zu mir:
„Jetzt kannst du ...“
Aber dann spricht er nicht weiter.
Er kann nicht mehr weitersprechen.
Sein Gesicht ist weiß wie Kreide.
„Herr Müller?“, sage ich.
„Herr Müller?“
Nichts.
Jürgen Müllers Kopf fällt nach vorne.
Sein Körper hängt schwer in dem Sicherheits-Gurt.
Ich fasse ihn an der Schulter an.
Ich schüttele ihn leicht.
Aber er sackt nur noch tiefer in sich zusammen.
 
Jede Kurzgeschichte von Marion Döbert ist wie ein Buch im Mini-Format.
Alle Geschichten haben einen wahren Kern.
Und sie regen dazu an, mutig zu sein, nicht aufzugeben oder
einfach mal über die Tragik des Lebens zu schmunzeln.
 Einmal Schnitzel mit Buch macht Appetit auf das Lesen und auf Bücher.
 
Lesen Sie hier die ersten Kapitel aus Einmal Schnitzel mit Buch! Ausschließlich zum Gebrauch als Leseprobe. Alle Rechte vorbehalten.Zubehör: Lesebegleitheft"
Ella auf Achse,https://einfachebuecher.de/media/c2/5b/60/1654876216/Ella_auf_Achse_lowres_m.jpg,"Ella bekommt eine große Chance beim Fernsehen. Ein Interview mit dem Schlager-Star Toni Rakete! Aber dann kommt alles anders …
 Toni Rakete trägt eine viel zu enge Lederhose. Sein Hemd hat er bis zum Bauchnabel aufgeknöpft. Damit man seine Brusthaare sehen kann. Igitt, wie eklig! Und den soll ich interviewen? Na, das kann ja was werden!
 Mit der Hilfe von ihren Freunden kann Ella sich aus einer schrecklichen Situation befreien. Aber hätte Ella auch anders handeln können?
Lesen Sie hier die ersten Kapitel aus Ella auf Achse! Ausschließlich zum Gebrauch als Leseprobe. Alle Rechte vorbehalten.
Zubehör: Lesebegleitheft"
Ellbogen,https://einfachebuecher.de/media/70/11/ae/1654876226/9783948856014_m.jpg,"Hazal ist fast 18 und lebt mit ihrer türkischen Familie in Berlin.
Sie und ihre Freundinnen fühlen sich dort nicht zu Hause. Nicht in Berlin, und nicht in ihren Familien.
Die Mädchen jobben und hängen rum.
Sie haben keine Ahnung, wie ihre Zukunft aussehen soll.
Wir stolpern zurück zum S-Bahnhof.
Gül schimpft die ganze Zeit laut vor sich hin.
Elma und ich schweigen.
Ich habe Wut im Bauch.
Genau wie Elma.
Ich kann ihre Wut spüren.
Sie wächst und wächst.
In dem Roman Ellbogen schreibt die junge Autorin über die Lage vieler junger Menschen in Deutschland mit ausländischen Wurzeln. Sie sind zerrissen zwischen dem, was ihre Familien von ihnen erwarten, und ihren eigenen Wünschen.
Lesen Sie hier die ersten Kapitel aus Ellbogen! Ausschließlich zum Gebrauch als Leseprobe. Alle Rechte vorbehalten.
Zubehör: Lesebegleitheft"
Entwurzelte Schatten,https://einfachebuecher.de/media/9b/d9/59/1654876238/Entwurzelte_Schatten_lowres_m.jpg,"Kommissar Viertaler ist seit ein paar Wochen in Pension. Jeden Morgen geht er mit seiner Hündin Hexle im Wald spazieren. Dabei begegnet er oft einem jungen Flüchtling, der im Wald joggt.

Doch an diesem Tag rennt ihm der Flüchtling plötzlich panisch entgegen.

 

Hexle fängt an zu bellen und zieht an der Leine.

Viertaler ist jetzt auch neugierig geworden.

Er steigt den Hang zur Brücke hinauf.

Obwohl er so viele Jahre lang mit Mord und Totschlag zu tun hatte, ist er schockiert.

Eine kopflose Leiche hat er auch noch nicht oft gesehen.

 

Viertaler kann nicht anders und mischt sich in die Ermittlungen ein. Zusammen mit einer Freundin will er herausfinden, wer der Mörder ist.

Und was hat eigentlich der Flüchtling mit dem Mord zu tun?



In Zusammenarbeit mit der Koordinationsstelle Inklusion vom Landkreis Landsberg am Lech.

 

Lesen Sie hier die ersten Kapitel aus Entwurzelte Schatten! Ausschließlich zum Gebrauch als Leseprobe. Alle Rechte vorbehalten.

Zubehör: Lesebegleitheft"
Erebos,https://einfachebuecher.de/media/db/1f/5e/1654876225/Erebos-lowres_m.jpg,"An einer Schule in London gibt es bei Nick und seinen Freunden nur noch ein Thema: das Computerspiel Erebos. Das Spiel hat strenge Regeln. Niemand darf darüber reden.
Schnell wird Nick süchtig nach dem Spiel. Erebos scheint alles über ihn zu wissen. Und Erebos erteilt ihm Aufträge. Diese muss Nick auch in der echten Welt ausführen.
Und dann kommt plötzlich ein ganz seltsamer Auftrag …
„Es geht um Mister Watson, euren Englisch-Lehrer.
Du wirst morgen in der ersten Pause in den Waschraum gehen.
Dort findest du in der hintersten Toilette ein kleines Fläschchen.
Nimm die Flasche und schütte den Inhalt in die Thermoskanne von Mister Watson.
Er darf es aber nicht merken!
Und vor allem:
Sorge dafür, dass dich niemand sieht!“
Erebos hat 2011 den Deutschen Jugendliteraturpreis gewonnen. Das Buch ist ein moderner Klassiker. Es zeigt, warum Computerspiele so beliebt sind, aber auch welche Gefahren von Spielen ausgehen können.
Lesen Sie hier die ersten Kapital aus Erebos! Ausschließlich zum Gebrauch als Leseprobe. Alle Rechte vorbehalten."
Erebos 2,https://einfachebuecher.de/media/f7/4d/64/1695207734/Erebos%202%20-%20cover%20Lowres.jpg,"Erebos ist wieder da. Und es hat
dazugelernt. Als Nick auf seinem Handy das vertraute rote Symbol entdeckt,
denkt er als erstes: Das muss ein Zufall sein. Dann erkennt er jedoch: Erebos
hat ihn wiedergefunden. Schon bald merkt Nick, dass er erneut zu einer
Spielfigur von Erebos geworden ist.

Und Erebos hat einen Plan, der
Nick und viele andere in große Gefahr bringt.

 

Nick sitzt immer noch an seinem
Schreibtisch.

„Das darf doch alles nicht wahr
sein“, flüstert er.

„Ich bin fertig mit Erebos. Ich
bin erwachsen.“

Auf dem Display erscheint ein
Satz:

Du irrst dich, Nick.

Erebos startet in eine neue
Runde.

Diesmal geht es um alles.

Nick schließt die Augen.

Das Spiel verfügt jetzt also
über Spracherkennung.

Wir warten, Nick.

„Da könnt ihr lange warten“,
sagt Nick.

„Ich bin kein kleiner Schüler
mehr.

Ich mache nicht mehr mit.“

Du wirst schon sehen, was dann
passiert.



Erebos 2 ist die spannende
und mitreißende Fortsetzung von dem Bestseller Erebos, der sich auch in Einfacher
Sprache großer Beliebtheit erfreut. Lesen Sie hier die ersten Kapitel aus Erebos 2! Ausschließlich zum Gebrauch als Leseprobe. Alle Rechte vorbehalten."
Erfolgreich ins Praktikum,https://einfachebuecher.de/media/e6/af/0f/1654876207/Erfolgreich_ins_Praktikum__mit_neuem_Untertitel-lowres_m.jpg,"In diesem Buch steht alles, was man über ein Praktikum wissen sollte.
Zum Beispiel: Wie findet man ein Praktikum, das zu einem passt? Was ist ein Praktikumsbetreuer? Und wie schreibt man einen Praktikumsbericht?
Die Antworten auf diese und andere Fragen stehen in diesem Buch.
Außerdem gibt es Interviews mit einem Lehrer und mit Praktikumsbetreuern aus verschiedenen Unternehmen. Und jede Menge Tipps, um sich gut auf ein Praktikum vorzubereiten.
Was soll man zum Beispiel anziehen? Und wie schafft man es, pünktlich zu sein? Über was spricht man im Bewerbungsgespräch?
Erfolgreich ins Praktikum ist ein praktischer Ratgeber für alle, die ein Praktikum machen wollen.
Lesen Sie hier die ersten Seiten aus Erfolgreich ins Praktikum! Ausschließlich zum Gebrauch als Leseprobe. Alle Rechte vorbehalten."
Erzählungen von Heinrich Böll,https://einfachebuecher.de/media/0b/5f/7f/1654876215/Heinrich_Boll_-_cover_lowres_m.jpg,"Onkel Otto gewinnt im Lotto und wird überfahren.
Charlotte heiratet nach Schweden,
aber sie liebt einen anderen.
Herr Brenig vergisst seine Weihnachts-Geschenke.
Ein Chef fällt tot um.
Und ein Kellner dreht durch.
 
35 Jahre habe ich als Kellner gearbeitet.
Immer tadellos. Ohne Fehler. Ohne Vorfälle.
Wie konnte mir das nur passieren?
Aber ich habe das alles gemacht:
Ich bin mit dem Aufzug zum Haus-Meister runtergefahren.
Ich habe mir Hammer und Meißel geholt.
Ich bin wieder nach oben gefahren,
und dann habe ich ein Loch in den Boden geschlagen.

Heinrich Böll ist einer der bedeutendsten deutschen Schriftsteller. 1972 hat er den Nobel-Preis für Literatur bekommen. Seine Erzählungen sind direkt aus dem Leben gegriffen. Und sie regen dazu an, über das eigene Leben und die Welt nachzudenken.
 Zu diesem Titel ist Unterrichtsmaterial erhältlich. Sie finden es hier.
Lesen Sie hier die ersten Kapitel aus Erzählungen von Heinrich Böll! Ausschließlich zum Gebrauch als Leseprobe. Alle Rechte vorbehalten.

 Zubehör: Lesebegleitheft"
Erzählungen von Hermann Hesse,https://einfachebuecher.de/media/b1/a5/6f/1654876200/Hermann_Hesse_-_cover_lowres_m.jpg,"Die Erzählungen von Hermann Hesse haben viele Themen.
Er schreibt über Kindheit und Jugend. Wie es ist, auf dem Land und in der Stadt zu leben.
Er schreibt aber auch oft über Liebe, Natur und Magie.
Und er erzählt von Außenseitern.
Weltweit lesen vor allem junge Menschen gerne seine Erzählungen.
 
Ich war 18 Jahre alt.
Ich arbeitete als Praktikant in einer kleinen Fabrik
in meiner Heimatstadt.
Ich genoss den Sommer und meine Jugend.
Ich spürte die Aufbruch-Stimmung
zwischen Kindheit und Erwachsen-Sein.
Auch wenn ich keinen Namen
für dieses Gefühl hatte.
 
Der Schriftsteller Hermann Hesse (1877-1962) ist auf der ganzen Welt bekannt.
Seine Romane, Erzählungen und Gedichte sind in mehr als 60 Sprachen übersetzt und rund um den Globus verbreitet. 1946 erhielt er den Nobelpreis für Literatur.
Lesen Sie hier die ersten Kapitel aus Erzählungen von Hermann Hesse! Ausschließlich zum Gebrauch als Leseprobe. Alle Rechte vorbehalten.Zubehör: Lesebegleitheft"
Erzählungen von Theodor Storm,https://einfachebuecher.de/media/2c/db/29/1665493090/Erz%C3%A4hlungen%20von%20Theodor%20Storm_lowres.jpg,"In diesem Buch finden sich vier
berühmte Erzählungen von Theodor Storm: Der Schimmelreiter, Bulemanns
Haus, Der kleine Häwelmann und John Riew‘.

Die Geschichten sind spannend und
dramatisch. Menschen erleben seltsame Dinge. 

Manche begegnen sogar Gespenstern.
Die wilde Natur wird zur unheimlichen Bedrohung. 

Geiz und Gier stürzen Menschen ins
Unglück. Alte Freunde sehen sich unerwartet wieder.

 

Auf einmal geben die Wolken

für einen Augenblick den Mond
frei.

Eine Gestalt reitet mir
entgegen.

Ein dunkler Reiter

auf einem großen, mageren
Schimmel.

Die Augen des Reiters glühen
wie Feuer.

Sein schwarzer Mantel flattert
im Wind.

 

Theodor Storm (1817-1888) gehört
zu den weltweit bekannten großen deutschen Schriftstellern.

Er wurde vor allem durch seine
Gedichte und Erzählungen (Novellen) bekannt. Storms Geschichten sind so
spannend und dramatisch, dass einige davon sogar verfilmt wurden.







Lesen Sie hier die ersten Kapitel aus Erzählungen von Theodor Storm. Ausschließlich zum Gebrauch als Leseprobe. Alle Rechte vorbehalten.

 Zubehör: Lesebegleitheft"
"Feiertage, Feste und Bräuche",https://einfachebuecher.de/media/6f/63/4e/1654876227/Feste_Feiertage_und_Braeuche_m.jpg,"Überall auf der Welt feiern die Menschen Feste. Dabei pflegen sie ihre Bräuche. Das sind Gewohnheiten, die man an bestimmten Tagen im Jahr mit anderen Menschen teilt.

 

Bei uns in Deutschland sind die großen Familien-Feste wie Weihnachten und Ostern besonders beliebt.

Kein Wunder! Man kann ausschlafen. Es gibt leckeres Essen. Und es gibt Geschenke.

Aber was genau feiern wir eigentlich an Weihnachten? Warum stellen wir einen Adventskranz mit vier Kerzen auf ? Und wieso färben wir zu Ostern Eier?

 

Feiertage erinnern an bestimmte Ereignisse oder an bedeutende Personen. In Deutschland haben die meisten Feste einen christlichen Ursprung.

Aber auch die Muslime, Juden, Hindus und Buddhisten in Deutschland feiern ihre eigenen Feste. Beim gemeinsamen Feiern werden Fremde oft zu Freunden. Mit diesem Buch möchten wir dazu beitragen.

 

Lesen Sie hier die ersten Kapitel aus Feiertage, Feste und Bräuche! Ausschließlich zum Gebrauch als Leseprobe. Alle Rechte vorbehalten.Zubehör: Lesebegleitheft"
Frankenstein,https://einfachebuecher.de/media/31/2b/72/1654876195/Frankenstein_-_cover_lowres_m.jpg,"Der Student Viktor Frankenstein forscht an der Universität Ingolstadt. Er baut heimlich den Körper eines Menschen nach. Doch der Forscher verliert bald die Macht über seine Schöpfung. Der künstliche Mensch erweist sich als richtiges Monster. Dieses Monster sehnt sich eigentlich nach Liebe und Freundschaft. Doch es bringt allen den Tod, die ihm zu nahe kommen …
Was habe ich getan?
Die Idee, selbst Leben zu schaffen:
War das denn eine gute Idee?
Ich möchte nicht mehr hinsehen.
Doch ich muss.
Mich überläuft ein Schauer.
Das Haar ist ganz schwarz.
Die Zähne dagegen sind ganz weiß.
Doch der Rest: Was für ein furchtbarer Anblick!
Die Haut ist gelb und faltig.
Auch die Augen sind gelb.
Die Adern treten deutlich hervor. Schwarze Lippen,
gerade wie ein Strich. Abscheulich!
Wie ein Monster sieht mein Mensch aus.
Die englische Schriftstellerin Mary Shelley schrieb „Frankenstein“ im Jahr 1818. Diese Grusel-Geschichte wurde sehr berühmt. Und schon viele Male verfilmt.
Lesen Sie hier die ersten Kapitel aus Frankenstein! Ausschließlich zum Gebrauch als Leseprobe. Alle Rechte vorbehalten.Zubehör: Lesebegleitheft"
Für Eile fehlt mir die Zeit,https://einfachebuecher.de/media/04/fe/92/1654876209/Fuer_Eile_fehlt_mir_die_Zeit_lowres_m.jpg,"Der Alltag ist gar nicht so langweilig wie manche Menschen denken. Man muss nur richtig hingucken. Horst Evers kann das. Und wie!
In diesen 14 Alltags-Geschichten beschreibt er mit viel Witz Situationen, die jedem Leser irgendwie bekannt vorkommen.
 
Der neue Mieter twittert ohne Internet.
Er brüllt einfach alles durchs Fenster auf den Hof.
„Boah, hab‘ ich Hunger!“
Oder „Oh nee, meine Drucker-Patrone ist leer!“
 
Horst Evers hat studiert und als Taxifahrer und Postbote gearbeitet. Jetzt ist er Autor und Kabarettist. Er schreibt viele Geschichten und erzählt auf der Bühne von seinem Alltag.
 
Lesen Sie hier die ersten Kapitel aus Für Eile fehlt mir die Zeit! Ausschließlich zum Gebrauch als Leseprobe. Alle Rechte vorbehalten.Zubehör: Lesebegleitheft"
Gemeinsam essen,https://einfachebuecher.de/media/35/ac/95/1654876218/Gemeinsam_essen_-_Hardcover_lowres_m.jpg,"„He, Ravi!“ Es ist Selma, das Mädchen aus dem Kurs.„Was machst du hier ganz alleine?“, fragt Selma.

„Ich bin einfach alleine“, sagt Ravi. „Ich lebe alleine,

ich esse alleine, ich schlafe alleine. Und du?“

Ravi kann gut kochen. Aber alleine essen ist blöd. Er geht immer öfter zum Imbiss. Bis es in seinem Deutsch-Kurs ein Fest gibt. Alle müssen etwas Leckeres mitbringen. Jetzt kann Ravi endlich zeigen, was er kann.

Gemeinsam essen gehört zur neuen Buchreihe WortPlus. Die illustrierte Reihe richtet sich an Erwachsene, die erst seit Kurzem Deutsch lernen.

In den Büchern werden Wortschatz und Grammatik auf Niveau A1 angewendet.

Lesen Sie hier die ersten Kapitel aus Gemeinsam essen! Ausschließlich zum Gebrauch als Leseprobe. Alle Rechte vorbehalten.

 Zubehör: Lesebegleitheft"
Geschichten aus dem Dschungelbuch,https://einfachebuecher.de/media/27/1d/0a/1654876222/Geschichten_aus_dem_Dschungelbuch_lowres_m.jpg,"Das Dschungelbuch ist eine weltberühmte Sammlung von Geschichten rund um den Jungen Mogli und die Tiere im indischen Dschungel.

Wölfe finden Mogli als kleinen Jungen im Dschungel. Sie ziehen ihn wie ihren eigenen Sohn auf. Mogli lernt die Sprache von den Tieren. Und er findet Freunde: Baghira, den Panther, und Balu, den Bären.

Doch Mogli hat auch Feinde, und die werden immer gefährlicher.

 

„Aber warum sollte mich jemand töten wollen?“, fragt er. „Ich verstehe das nicht.“

„Sieh mich an“, befiehlt Baghira. 

Mogli sieht ihm direkt in die Augen. Der Panther wendet schon bald den Blick ab.

„Darum“, sagt er. „Nicht einmal ich kann dir in die Augen sehen. 

Und ich liebe dich, mein Bruder. 

Aber die anderen hassen dich.

Weil du stärker bist. 

Weil du Verstand hast.

Weil du die Dornen aus ihren Pfoten gezogen hast.

Weil du ein Mensch bist.“

 

Dieses Buch erzählt in drei Geschichten von Moglis Leben im Dschungel und wie er das erste Mal andere Menschen trifft.

 

Lesen Sie hier die ersten Kapitel aus dem Dschungelbuch! Ausschließlich zum Gebrauch als Leseprobe. Alle Rechte vorbehalten.Zubehör: Lesebegleitheft"
Girl on the Train - Das Mädchen im Zug,https://einfachebuecher.de/media/10/b6/79/1654876245/Girl_on_the_train_-_cover_Final_Lowres_m.jpg,"Rachel fährt jeden Morgen mit dem Zug. Nicht um zur Arbeit zu gehen, wie ihre Mitbewohnerin denkt. Sondern weil der Zug immer eine Weile dort hält, wo sie früher gewohnt hat. Vom Zug aus blickt Rachel auf ihre alte Straße. Und auf Scott und Megan, das perfekte Paar aus dem Haus mit der Nummer 20. Doch eines Tages beobachtet Rachel dort etwas Schockierendes. Und dann liest sie in der Zeitung, dass Megan vermisst wird…

Rachel hat die beiden schon öfter gesehen. Rachel beobachtet sie gerne. Die beiden lieben sich sehr. Das sieht man sofort. Sie haben ein schönes Haus. 

Glück. Liebe.

Alles, was Rachel nicht hat. Nicht mehr jedenfalls.

Lesen Sie hier die ersten Kapitel aus Girl on the Train! Ausschließlich zum Gebrauch als Leseprobe. Alle Rechte vorbehalten.Zubehör: Lesebegleitheft"
"Good Bye, Lenin!",https://einfachebuecher.de/media/96/0d/a2/1654876185/goodbye_lenin_-_cover_hires_m.jpg,"Alex lebt in der DDR, in Ost-Berlin. Es ist das Jahr 1989. Deutschland ist geteilt. Doch dann kommt es in der DDR zum Aufstand. Und auf einmal sind die Grenzen offen.

Alex’ Mutter ist überzeugte Kommunistin. Sie bekommt nichts von den Ereignissen mit. Sie hatte einen Herzinfarkt und liegt im Koma. Als sie wieder aufwacht, gibt es die DDR nicht mehr. Wie soll Alex seiner Mutter das erklären? Er beschließt, ihr nichts von der Revolution zu erzählen. Ein gewagtes Spiel mit der Wahrheit beginnt.

Good Bye, Lenin! – ein Buch in Einfacher Sprache – geschrieben in Anlehnung an den gleichnamigen Spielfilm von Wolfgang Becker und Bernd Lichtenberg aus dem Jahr 2003.Zu diesem Titel ist Unterrichtsmaterial erhältlich. Sie finden es hier.

Lesen Sie hier die ersten Kapitel aus Good Bye, Lenin! Ausschließlich zum Gebrauch als Leseprobe. Alle Rechte vorbehalten.Zubehör: Lesebegleitheft"
Grimms Märchen,https://einfachebuecher.de/media/5f/aa/08/1654876242/Grimms_Maerchen_lowres_m.jpg,"Rotkäppchen geht zum Bett.
Sie erschrickt.
Ihre Großmutter sieht heute seltsam aus.
„Oh, Großmutter, was hast du für große Ohren!“,
sagt Rotkäppchen.
„Damit ich dich besser hören kann!“,
antwortet der Wolf.


Unsere Reihe VOLKSERZÄHLUNGEN öffnet die Märchentruhe! Wir stellen bekannte Geschichten aus unterschiedlichen Ländern in Einfacher Sprache vor. Die Märchen sind kurz und eignen
sich auch hervorragend zum Vorlesen, am Ende einer Unterrichtsstunde zum Beispiel.

 Lesen Sie hier die ersten Kapitel aus Grimms Märchen! Ausschließlich zum Gebrauch als Leseprobe. Alle Rechte vorbehalten.Zubehör: Lesebegleitheft"
Hannes,https://einfachebuecher.de/media/45/04/b8/1654876213/Hannes_-_cover_Lowres_m.jpg,"Hannes und Uli sind beste Freunde. Sie kennen sich seit ihrer Kindheit und haben schon viel Blödsinn zusammen gemacht. Aber ihre Idee, im Februar eine Motorrad-Tour zu unternehmen, hat furchtbare Folgen. Hannes stürzt mit seinem Motorrad und liegt seitdem im Koma. Uli fängt an, seinem Freund Briefe zu schreiben. Damit Hannes weiß, was in der Zwischenzeit alles passiert. Das Schreiben hilft Uli auch, mit der traurigen Situation fertigzuwerden.
Hannes,
du merkst schon,
ich schreibe einfach alles auf.
Was mir gerade so einfällt
oder was dich interessieren könnte.
So haben wir früher ja auch drauflos gequatscht,
wenn wir uns getroffen haben.
Natürlich wäre es besser,
wenn du endlich mal aufwachen würdest.
Ich musste gestern allein ins Stadion zum Eishockey gehen.
Das war wirklich öde.
Aber solange du dein Koma-Schläfchen machst,
schreibe ich erst mal weiter.
Rita Falk ist mit ihren humorvollen Krimis aus der bayerischen Provinz bekannt geworden. Einige dieser Bücher um den Polizisten Eberhofer sind bereits für das Fernsehen verfilmt worden. Mit dem Roman „Hannes“ hat Rita Falk jetzt eine nachdenkliche Geschichte über Freundschaft und das Leben geschrieben.
Lesen Sie hier die ersten Kapitel aus Hannes! Ausschließlich zum Gebrauch als Leseprobe. Alle Rechte vorbehalten.Zubehör: Lesebegleitheft"
Heimatlos,https://einfachebuecher.de/media/0e/2b/c0/1654876237/Heimatlos_-_cover_lowres_m.jpg,"Remi ist ein Findelkind. Mit acht Jahren wird Remi
von seinem Pflege-Vater an einen Straßen-Musiker
verkauft. So beginnt eine lange Reise kreuz und quer
durch Frankreich. Wo wird die Reise für Remi enden?

 

„Jetzt bringe ich dir bei,
wie man Leute zum Lachen bringt“, sagt Vitalis.
„Oh, nein!“, rufe ich.
„Das kann ich doch nicht!“
Vitalis muss lachen.
Er sagt: „Nur die Ruhe.
Ich habe es meinen Hunden
und meinem Affen beigebracht.
Du kannst das auch lernen.“


Heimatlos ist ein bekannter Roman aus dem Jahr 1878.
Das Buch erzählt viel über das Leben der armen Leute
in Frankreich vor ungefähr 150 Jahren..

 

Lesen Sie hier die ersten Kapitel aus Heimatlos! Ausschließlich zum Gebrauch als Leseprobe. Alle Rechte vorbehalten.

 Zubehör: Lesebegleitheft"
Herz ohne Grenzen,https://einfachebuecher.de/media/9c/8d/ac/1654876237/Herz_ohne_Grenzen_lowres_m.jpg,"Florence sucht verzweifelt nach dem Sinn ihres Lebens. Als Tochter aus reichem Elternhaus darf sie keiner Arbeit nachgehen. Auch Studieren ist Frauen nicht erlaubt.
Frauen sollen heiraten, einen Haushalt führen und Gäste empfangen.
Florence möchte lieber sterben, als ein solches Leben zu führen.
Am Abend sitzen wir zusammen am Tisch:
Mutter, Vater, Parthe und ich.
Beim Essen sage ich auf einmal:
„Ich will in einem Krankenhaus helfen,
in der Nähe von London.“
Meine Mutter fängt an zu zittern.
Mein Vater starrt auf seinen Teller.
Parthe sagt aufgeregt:
„Jetzt willst du uns wohl auch noch sagen,
dass du Kranken-Pflegerin werden willst?“
Ich zögere einen Moment.
Dann sage ich:
„Ja, genau das.
Genau das will ich werden.“
Florence Nightingale (12.05.1820- 13.08.1910) hat ihre Ziele nie aus dem Auge verloren.
Gegen alle Widerstände aus der Männerwelt hat sie es geschafft,
dass Krankenpflege ein anerkannter Beruf geworden ist.
Sie hat das gesamte Gesundheits-System bis in die heutige Zeit hinein geprägt.
Für ihre Arbeit erhielt sie hohe Orden und Auszeichnungen.
Der 12. Mai ist weltweit ihr zu Ehren der Internationale Tag der Krankenpflege.

 

Lesen Sie hier die ersten Kapitel aus Herz ohne Grenzen! Ausschließlich zum Gebrauch als Leseprobe. Alle Rechte vorbehalten.

 Zubehör: Lesebegleitheft"
