name,image,description
Der Lottoschein,https://einfachebuecher.de/media/5b/99/71/1691061981/Der%20Lottoschein%20-%20cover%20Lowres.jpg,"Hassan arbeitet in einer Autowerkstatt. Eines
Tages lernt er die schöne Assina kennen.
Als sie ihm ihre Nummer gibt, kann Hassan es
kaum glauben.
Er will gerne mit ihr ausgehen. Aber er hat nicht
genug Geld.
Also beschließt Hassan, Lotto zu spielen. Wenn
er gewinnt, will er Assina anrufen.
Aber das Schicksal hat andere Pläne mit ihm…
Lesen Sie hier die ersten Kapitel aus Der Lottoschein! Ausschließlich zum Gebrauch als Leseprobe. Alle Rechte vorbehalten."
Der Schutzkeller,https://einfachebuecher.de/media/eb/6a/b1/1654876247/Der_Schutzkeller_hires_m.jpg,"Ein packender Krimi in einfacher Sprache! Lizzy und Bert führen eine gute Ehe. Bis sie im Fernsehen eine Sendung über Atombomben sehen. Lizzy ist nun davon überzeugt, dass ihnen ein Atomkrieg bevorsteht. Und dass sie alle sterben werden. Bert lässt einen Schutzkeller bauen. Und denkt sich gleichzeitig einen tückischen Plan aus.

Der Schutzkeller ist die vereinfachte Überarbeitung einer Kriminalgeschichte von Tomas Ross. Tomas Ross ist ein bekannter niederländischer Kriminalautor. Er wurde dreifach mit dem Gouden Strop ausgezeichnet, dem Preis für den besten Krimi in niederländischer Sprache.

Lesen hier die ersten Kapitel aus Der Schutzkeller! Ausschließlich zum Gebrauch als Leseprobe. Alle Rechte vorbehalten.Zubehör: Lesebegleitheft"
Der seltsame Fall von Dr Jekyll und Mr Hyde,https://einfachebuecher.de/media/a2/a4/26/1654876192/Der_Seltsame_Fall_von_Dr_Jekyll__Mr_Hyde_-_cover_m.jpg,"Schon als Kind weiß Doktor Jekyll, dass er nicht so ist wie andere Menschen. In ihm leben zwei Persönlichkeiten. Er hat eine normale und eine dunkle Seite. Diese dunkle Seite ist sein grausamer Doppelgänger: Mr. Hyde. Mit Hilfe eines geheimnisvollen Elixiers versucht Dr. Jekyll die dunkle Kraft von Mr. Hyde zu bekämpfen. Doch Mr. Hyde wird immer mächtiger. Schreckliche Dinge drohen zu geschehen.

Da kam plötzlich ein kleiner Mann aus der
Gegenrichtung angerannt.
Er stieß so heftig mit dem Mädchen zusammen,
dass es zu Boden fiel.
Doch dann geschah etwas Furchtbares:
Anstatt stehen zu bleiben, trampelte der Mann
über das Mädchen hinweg.
Und rannte einfach weiter.
Als hätte er es überhaupt nicht bemerkt.
Als sei nichts geschehen.

Der seltsame Fall von Dr. Jekyll und Mr. Hyde ist eine Erzählung von Robert Louis Stevenson. Die Geschichte erschien bereits im Jahr 1886. Sie ist eine der berühmtesten Kriminalgeschichten der Welt.Zu diesem Titel ist Gratis-Unterrichtsmaterial erhältlich. Sie finden es hier.Lesen Sie hier die ersten Kapitel aus Der seltsame Fall von Dr. Jekyll und Mr Hyde! Ausschließlich zum Gebrauch als Leseprobe. Alle Rechte vorbehalten.Zubehör: Lesebegleitheft"
Der Sonne nach,https://einfachebuecher.de/media/c2/ed/c4/1677157331/Der%20Sonne%20nach%20-%20cover_Final%20Lowres.jpg,"Dario hat keine Lust auf die Schule und gerät
immer wieder in Schwierigkeiten. Eines
Tages wird er zu Sozialstunden verdonnert:
er soll sich um Andy kümmern. Andy sitzt
im Rollstuhl und kann nicht sprechen.
Dario weiß nicht so recht, was er mit Andy
anfangen soll. Kurzerhand setzt er sich mit
ihm in den Zug. Zusammen fahren sie ans
Meer – immer der Sonne nach. Sie fahren
dahin, wo Darios Vater wohnt, den er seit
seiner Kindheit nicht mehr gesehen hat. Was
als spontaner Einfall startet, wird zu einem
großen Abenteuer. Und am Ende findet
Dario etwas, womit er am Anfang niemals
gerechnet hat.



Schnell wie ein Pfeil flitzt
Dario zum Haupteingang.

Er schiebt Andy die Betonrampe
hinunter,

rennt über den Schulhof und aus
dem Schulgelände.

Andy kreischt und lacht, die
Sonne im Gesicht.

Jetzt die Straße runter und
dann in den Park.

Schnell wie ein Rennwagen.

„Sonne!“, ruft Dario.

Er breitet die Arme aus.

„Onne!“, wiederholt Andy

mit weit aufgerissenen Augen.






Lesen Sie hier die ersten Seiten aus Der Sonne nach. Ausschließlich zum Gebrauch als Leseprobe. Alle Rechte vorbehalten."
Deutschstunde,https://einfachebuecher.de/media/99/77/d5/1654876237/Deutschstunde_-_cover_Final_Lowres_m.jpg,"Siggi Jepsen ist in einer Anstalt für schwer erziehbare Jugendliche.
Dort muss er eine Strafarbeit schreiben zum Thema „Die Freuden der Pflicht“.
Sofort fällt ihm dazu sein Vater Ole Jepsen ein.
Sein Vater ist Polizist in einem abgelegenen Ort im Norden Deutschlands.
Mit seinem unbedingten Gehorsam unterstützt der Dorfpolizist das Naziregime.
Ohne Rücksicht auf Familie, Freunde oder Nachbarn erfüllt er alle Befehle von oben.
Nach und nach verliert er dadurch auch seinen Sohn.

 

Mein Vater hat das Skizzenbuch des Malers verbrannt!
Ich sehe ihn erschrocken an.
Er sieht zufrieden aus, steht ruhig da und raucht.
Er ist zufrieden, wie nach einem vollbrachten Auftrag.
In diesem Moment fürchte ich mich zum ersten Mal vor meinem Vater.

 

Siegfried Lenz erzählt in seinem fesselnden Roman „Deutschstunde“ auch ein Stück deutscher Geschichte. Dabei steht im Mittelpunkt, wie die einzelnen Menschen in ihrem Alltag politisches Unrecht unterstützten oder aber mit Widerstand bekämpften.

 

Lesen Sie hier die ersten Kapitel aus Deutschstunde! Ausschließlich zum Gebrauch als Leseprobe. Alle Rechte vorbehalten.

 Zubehör: Lesebegleitheft"
Die Abenteuer von Baron Münchhausen,https://einfachebuecher.de/media/de/32/b2/1654876239/Die_Abenteuer_von_Baron_Muenchhausen_lowres_m.jpg,"Baron Münchhausen erzählte gerne Geschichten von den Abenteuern, die er auf seinen Reisen und bei der Jagd erlebte.

Seine Geschichten waren lustig und ziemlich verrückt. Denn der Baron hatte viel Fantasie und dachte sich seine Abenteuer nur aus.

Mit ernstem Gesicht erzählte er die wildesten Lügen.

Die bekanntesten und lustigsten Geschichten sind in diesem Buch versammelt.

 

Dann verstecke ich mich im Schilf

und werfe den Speck ins Wasser.

Eine Ente schluckt den Speck hinunter.

Am anderen Ende kommt der Speck jedoch

gleich wieder heraus!

Dann schluckt die zweite Ente den Speck.

Und das geht so weiter, bis alle Enten

den Speck geschluckt haben.

Jetzt habe ich alle Enten wie Perlen

an einer Schnur.

Lesen Sie hier die ersten Kapitel aus Die Abenteuer von Baron Münchhausen! Ausschließlich zum Gebrauch als Leseprobe. Alle Rechte vorbehalten.

Zubehör: Lesebegleitheft"
Die Abenteuer von Huckleberry Finn,https://einfachebuecher.de/media/07/75/98/1654876208/Die_Abeneteuer_von_Huckleberry_Finn-lowres_m.jpg,"„Jim! Jim!“, rufe ich leise.

Da taucht Jim im Dunkeln auf. 

„Schnell, Jim“, flüstere ich. 

„Da drin ist eine Bande Mörder. 

Schnell, wir machen ihr Ruderboot los. 

Sie müssen ja auch mit einem Boot gekommen sein.

Wenn das weg ist, sitzen sie auf dem Wrack fest 

und können nicht fort. 

Und wir können den Sheriff holen.“

 

Huck ist auf der Flucht vor seinem gewalttätigen Vater. Auf der Reise trifft er Jim, einen geflohenen Sklaven. Zusammen fahren sie auf einem Floß den Mississippi hinab. Es ist eine spannende Reise mit vielen gefährlichen Abenteuern. Kann Jim seine Familie retten? Und sieht Huck seinen besten Freund Tom Sawyer jemals wieder?Lesen Sie hier die ersten Kapitel aus Die Abenteuer von Huckleberry Finn! Ausschließlich zum Gebrauch als Leseprobe. Alle Rechte vorbehalten.Zubehör: Lesebegleitheft"
Die Abenteuer von Tom Sawyer,https://einfachebuecher.de/media/bb/ae/4a/1654876208/Die_Abenteuer_von_Tom_Sawyer_-_cover_Lowres_m.jpg,"Tom will nur eins: Abenteuer erleben! Und dafür tut er so Einiges. Mit seinem Freund Huck geht er nachts auf einen Friedhof. Und die beiden besuchen ein Geisterhaus, weil dort ein Schatz versteckt sein soll. Außerdem gründet Tom eine Räuberbande.

Und dann ist da ja noch Becky. Tom ist in sie verliebt, doch dann verirren sie sich gemeinsam in einer Höhle …

 

„Huck“, flüstert Tom in der Totenstille.

„Sind die Toten damit einverstanden, dass wir hier sind?“

Huck zuckt mit den Schultern.

„Weiß ich nicht. Aber sag lieber nichts über sie.“

Tom nickt. „Ja, das ist …“

Plötzlich schweigt er. Denn er hört eine Stimme, vom anderen Ende des Friedhofs.Lesen Sie hier die ersten Kapitel aus Die Abenteuer von Tom Sawyer! Ausschließlich zum Gebrauch als Leseprobe. Alle Rechte vorbehalten.

 Zubehör: Lesebegleitheft"
Die Blaumacher,https://einfachebuecher.de/media/ae/b6/61/1654876228/Die_Blaumacher_lowres_m.jpg,"Nick ist neu auf der Schule. Er ist mit seiner Mutter von Amerika nach Deutschland gezogen. In Deutschland findet er alles blöd. Ihm fehlen Amerika, seine Musik und sein Vater. Aber dann trifft er Mara. Und er verliebt sich.
Und dann wird er auch noch Mitglied in der Band von der 10A. Endlich kann Nick wieder Keyboard spielen.
Mara wird seine Freundin und Sängerin in der Band. Nach ihrem ersten Auftritt bekommt die Band sogar einen Job: Sie soll den Sommer über auf einem Campingplatz spielen.
Alles klingt toll, aber dann holt einer von den Jungen die erste Flasche Bier hervor. Und es wird nicht bei einer bleiben.
Die Reality Reihe ist eine Bücherreihe für und über Jugendliche. 
Lesen Sie hier die ersten Kapitel aus Die Blaumacher! Ausschließlich zum Gebrauch als Leseprobe. Alle Rechte vorbehalten.
Zubehör: Zu jedem Buch in unserer Reality Reihe gibt es gratis Unterrichtsmaterial. Das Material zu ""Die Blaumacher"" finden Sie hier; Lesebegleitheft"
Die fetten Jahre sind vorbei,https://einfachebuecher.de/media/53/93/99/1654876189/Die_fetten_Jahre_sind_vorbei_m.jpg,"Jan und Peter kennen sich seit vielen Jahren. Die beiden Freunde brechen nachts in die Häuser von Reichen ein. Sie stehlen nichts, aber bringen alles durcheinander.

Peters Freundin, Jule, weiß von nichts. Bis sich Jan und Jule ineinander verlieben. Als Jan mit Jule zusammen einbricht, gibt es eine böse Überraschung. Der Besitzer der Villa steht plötzlich da. Jan schlägt ihn nieder.

In dem Roman Die fetten Jahre sind vorbei geht es darum, wie junge Menschen sich gegen Ungerechtigkeit wehren. Es geht um die Macht des Geldes, um Liebe und Freundschaft.

Die fetten Jahre sind vorbei - ein Buch in Einfacher Sprache - geschrieben in Anlehnung an den gleichnamigen Film von Hans Weingartner aus dem Jahr 2004.

Zu diesem Titel ist Gratis-Unterrichtsmaterial erhältlich. Sie finden es hier. Lesen Sie hier die ersten Kapitel aus Die fetten Jahre sind vorbei! Ausschließlich zum Gebrauch als Leseprobe. Alle Rechte vorbehalten. Zubehör: Lesebegleitheft"
Die Flüsse von London,https://einfachebuecher.de/media/0c/19/78/1654876190/Die_Fluesse_von_London_-_cover_m.jpg,"Ein grausiger Mord, mitten in London. Am Tatort macht der junge Polizist Peter Grant eine Entdeckung. Der einzige Zeuge ist – ein Geist. Peter Grant wird Zauberlehrling. Im Dienst der Polizei jagt er den Mörder. Aber der Unbekannte schlägt zurück ...

Da kommt er aus dem Schatten der Säule.
Er ist durchsichtig. Er sieht aus wie ein richtiger Mensch.
Aber er ist durchsichtig. Verdammt noch mal!
Ich kann durch ihn hindurchsehen.

Ben Aaronovitch wurde 1964 in London geboren. Dort lebt und arbeitet er bis heute. Ben Aaronovitch hat Drehbücher für Fernseh-Serien und Bücher geschrieben. Über den Polizisten und Zauber-Lehrling Peter Grant gibt es noch mehr Bücher (Deutsch von Karlheinz Dürr).Zu diesem Titel ist Gratis-Unterrichtsmaterial erhältlich. Sie finden es hier.Lesen Sie hier die ersten Kapitel aus Die Flüsse von London! Ausschließlich zum Gebrauch als Leseprobe. Alle Rechte vorbehalten.
Zubehör: Lesebegleitheft"
Die Fremden am Deich,https://einfachebuecher.de/media/41/c3/e7/1654876197/Die_Fremden_am_Deich_-_cover_Lowres_m.jpg,"Wilma lebt allein in ihrem Haus am Deich. Mit ihrer Tochter spricht sie seit einem Streit nicht mehr. Und dann werden in der alten Fischerei gegenüber Flüchtlinge untergebracht. Die Fremden machen Wilma Angst. Doch wer sitzt da nach einem Schwindelanfall an Wilmas Bett? Ihre Tochter Hanna?
„Aber warum denn hier?“, fragt Wilma.
„Hier gibt es doch nichts. Nicht mal einen Laden.“
„Das würde ich auch gern wissen“, sagt Hans.
„Wir haben kein anderes Gebäude gefunden“
sagt der Polizist. „Wir suchen nach einer Lösung.
Aber jetzt bleiben die Flüchtlinge erstmal hier.“ 

Lesen Sie hier die ersten Kapitel aus Die Fremden am Deich! Ausschließlich zum Gebrauch als Leseprobe. Alle Rechte vorbehalten.Zubehör: Lesebegleitheft"
Die Geschichte von Betty,https://einfachebuecher.de/media/0f/0f/6c/1654876197/Die_Geschichte_von_Betty_-_lowres_m.jpg,"Betty zählt das Geld.
Eins, zwei, drei, vier...
Fünf 50 Euro-Scheine!
„Ich muss zurückgehen“,
denkt Betty.
„Ich muss das Geld
zurückgeben.“
 

Betty findet eine Geld-Börse mit einer Menge Geld darin. Sie kann das Geld gut gebrauchen. Soll sie das Geld behalten?

Die Geschichte von Betty ist Teil unserer Bücherreihe Mitten im Leben in Leichter Sprache. Diese Serie wurde für Lese-Anfänger entwickelt. Autor ist Johan van Caeneghem. Er ist Lehrer in der Erwachsenenbildung.Lesen Sie hier die ersten Kapitel aus Die Geschichte von Betty! Ausschließlich zum Gebrauch als Leseprobe. Alle Rechte vorbehalten.

 Zubehör: Lesebegleitheft"
Die Geschichte von Haias,https://einfachebuecher.de/media/2a/68/de/1654876199/Haias_cover_-_lowres_m.jpg,"Eine Erzählung in Einfacher Sprache mit Übungen

Haias ist im Alter von 14 Jahren mit seinen Eltern und drei Geschwistern aus dem Irak über Syrien nach Deutschland geflüchtet. Heute ist er 18 Jahre alt, macht eine Ausbildung zum Metallbauer und besucht gleichzeitig 3-mal pro Woche die Schule (duale Berufsausbildung). Er erzählt über sein Leben im Irak, die Schule und Hobbys dort. Er spricht auch über seine Familie und über sein neues Leben in Deutschland.

Die Geschichte von Haias ist Band 2 der multimedialen Serie über minderjährige Flüchtlinge in Deutschland: Woher kommen sie? Wer sind sie? Wie sind sie nach Deutschland gekommen?

Über diese Fragen sprechen sie und erzählen auf sehr persönliche Weise ihre Geschichte.

Zu jedem Kapitel gibt es Übungen und Aufgaben in zwei Schwierigkeitsstufen. Sie helfen beim Verständnis und erleichtern den Zugang.

Dr. Alexis Feldmeier García ist wissenschaftlicher Mitarbeiter in der Abteilung Sprachdidaktik am Germanistischen Institut der Westfälischen Wilhelms-Universität Münster.

Lesen Sie hier die ersten Kapitel aus Die Geschichte von Haias! Ausschließlich zum Gebrauch als Leseprobe. Alle Rechte vorbehalten.

Zubehör: Lesebegleitheft

Audiodateien - Die Geschichte von Haias:Haias EinleitungHaias - 1. Heimat

Haias - 1. Heimat-langsamHaias - 2. Fußball

Haias - 2. Fußball-langsamHaias - 3. FreizeitHaias - 3. Freizeit-langsam

Haias - 4. Schule

Haias - 4. Schule-langsam

Haias - 5. Weg

Haias - 5. Weg-langsam

Haias - 6. Bielefeld

Haias - 6. Bielefeld-langsam"
Die Geschichte von Jan,https://einfachebuecher.de/media/83/65/b9/1654876201/Die_Geschichte_von_Jan_-_cover_lowres_m.jpg,"Jan fährt nach Hause.
Er hat Herzklopfen.
Und er schwitzt.
Zuhause geht er unter die Dusche.
Und dann trinkt er ein Bier.
„Ich muss etwas tun“, denkt Jan.
„Ich muss mit ihr reden.“
Aber wie soll er das machen?
Jan ist nicht dumm.
Aber ihm fällt nichts ein.
Jan hat sich in Gloria verliebt. Gloria arbeitet im Dorf. In der Bäckerei.
Jan traut sich nicht, Gloria anzusprechen. Was soll er bloß machen?
Die Geschichte von Jan ist Teil unserer Bücherreihe Mitten im Leben in Leichter Sprache. Diese Serie wurde für Lese-Anfänger entwickelt. Autor ist der Niederländer Johan van Caeneghem. Er ist Lehrer in der Erwachsenenbildung.
Lesen Sie hier die ersten Kapitel aus Die Geschichte von Jan! Ausschließlich zum Gebrauch als Leseprobe. Alle Rechte vorbehalten.Zubehör: Lesebegleitheft"
Die Geschichte von Jens,https://einfachebuecher.de/media/66/c1/a1/1654876199/Die_Geschichte_von_Jens_-_cover_lowres_m.jpg,"„Ich will nur reden“, sagt der Mann.
„Ist das ein Problem?“
„Ich will aber nicht reden“, sagt Jens.
„Ich kenne Sie nicht.“
Aber der Mann geht nicht weg.
Jens schaut sich um.
Gibt es hier keine Polizei?
Aber er sieht keine Polizei.
Jens wartet auf den Zug. Er ist müde und will nach Hause. Ein Mann will mit ihm reden. Jens ist genervt. Denn der Mann riecht nach Alkohol. Wie wird Jens den Mann los?
Die Geschichte von Jens ist Teil unserer Bücherreihe in Leichter Sprache. Diese Serie wurde für Lese-Anfänger entwickelt. Autor ist der Niederländer Johan van Caeneghem. Er ist Lehrer in der Erwachsenenbildung.Lesen Sie hier die ersten Kapitel aus Die Geschichte von Jens! Ausschließlich zum Gebrauch als Leseprobe. Alle Rechte vorbehalten.Zubehör: Lesebegleitheft"
Die Geschichte von Katja,https://einfachebuecher.de/media/71/f1/8c/1654876220/Die_Geschichte_von_Katja_Cover_m.jpg,"Im Wohn-Zimmer steht ein Mann.

„Guten Abend!“, sagt er.

„Hauen Sie ab!“, ruft Katja.

„Aber …“, sagt er.

Katja kreischt: „Hauen Sie ab! Sonst … „

Sie nimmt einen Aschen-Becher.

 

Nachts kommt ein fremder Mann in Katjas Haus.

Ein Dieb! Oder doch nicht?

 

Die Geschichte von Katja ist Teil unserer Buchreihe Mitten im Leben. Diese Serie wurde für Lese-Anfänger entwickelt. Autor ist Johan van Caeneghem. Er ist Lehrer in der Erwachsenenbildung.

 

Lesen Sie hier die ersten Kapitel aus Die Geschichte von Katja! Ausschließlich zum Gebrauch als Leseprobe. Alle Rechte vorbehalten.

 Zubehör: Lesebegleitheft"
Die Geschichte von Kim,https://einfachebuecher.de/media/a2/c0/b2/1654876204/Die_Geschichte_von_Kim_-_cover_lowres_m.jpg,"„Alles geht hier kaputt“, sagt Emma.
„Die Heizung, die Elektrizität ...
Warum ziehst du nicht aus?
Warum ziehst du nicht zu mir?“
„Das weißt du doch“, sagt Kim.
„Weil mir das zu schnell geht“.
„Zu schnell?“, fragt Emma.
Sie steht auf.
Sie ist sauer.
Kim wohnt in einer kleinen, alten Wohnung. Ihre Freundin Emma wohnt in einem schönen, großen Haus. Werden die beiden zusammenziehen?
Die Geschichte von Kim ist Teil unserer Bücherreihe in Leichter Sprache. Diese Serie wurde für Lese-Anfänger entwickelt. Autor ist der Niederländer Johan van Caeneghem. Er ist Lehrer in der Erwachsenenbildung.
Lesen Sie hier die ersten Kapitel aus Die Geschichte von Kim! Ausschließlich zum Gebrauch als Leseprobe. Alle Rechte vorbehalten.Zubehör: Lesebegleitheft"
Die Geschichte von Marco,https://einfachebuecher.de/media/28/21/b4/1654876196/Die_Geschichte_von_Marco_-_lowres_m.jpg,"Marco liefert Pakete ab.Er fährt von hier nach da.
Durch die ganze Stadt.
Manchmal liefert er 40 Pakete
am Tag ab.
„Das ist viel“, denkt er.
„Zuviel.“

Marco weiß nicht mehr, was er machen soll. Sein Chef gibt ihm viel zu viel Arbeit. Wie soll er das alleine schaffen? Aber dann trifft er Lisa...

Die Geschichte von Marco ist Teil unserer Bücherreihe Mitten im Leben in Leichter Sprache. Diese Serie wurde für Lese-Anfänger entwickelt. Autor ist Johan van Caeneghem. Er ist Lehrer in der Erwachsenenbildung.

Lesen Sie hier die ersten Kapitel aus Die Geschichte von Marco! Ausschließlich zum Gebrauch als Leseprobe. Alle Rechte vorbehalten.Zubehör: Lesebegleitheft"
Die Geschichte von Maria,https://einfachebuecher.de/media/80/c2/3c/1654876220/Die_Geschichte_von_Maria_-_cover_Lowres_m.jpg,"Maria setzt sich an einen Tisch.

Sie denkt an ihren

Deutsch-Lehrer.

 

„Sie müssen rausgehen“,

sagt ihr Lehrer immer.

„Und mit Leuten reden.“

 

Wenn man neu ist in einem Land, ist alles schwer. Vor allem öffentliche Verkehrs-Mittel. Maria nimmt zum ersten Mal die Straßen-Bahn. Aber wie kommt sie wieder nach Hause?

 

Die Geschichte von Maria ist Teil unserer Buchreihe Mitten im Leben. Diese Serie wurde für Lese-Anfänger entwickelt. Autor ist Johan van Caeneghem. Er ist Lehrer in der Erwachsenenbildung.

 

Lesen Sie hier die ersten Kapitel aus Die Geschichte von Maria! Ausschließlich zum Gebrauch als Leseprobe. Alle Rechte vorbehalten.Zubehör: Lesebegleitheft"
Die Geschichte von Nicky,https://einfachebuecher.de/media/cf/3b/85/1654876200/Die_Geschichte_von_Nicky_-_cover_lowres_m.jpg,"Dann hört Nicky ein Auto in der Nähe.
Es hält an.
Jemand steigt aus.
Und kommt zu ihr.
„Hallo“, sagt ein Mann.
„Wartest du auf den Bus?“
Es ist ein junger Mann, hört Nicky.
„Redest du mit mir?“, fragt Nicky.
„Ja“, sagt der Mann.
„Findest du das blöd?“Nicky sieht schlecht und wohnt noch bei ihren Eltern. Sie hat keine Freunde. Und sie kann keine Arbeit finden. Aber dann trifft sie Ken ...
Die Geschichte von Nicky ist Teil unserer Bücherreihe Mitten im Leben in Leichter Sprache. Diese Serie wurde für Lese-Anfänger entwickelt. Autor ist der Niederländer Johan van Caeneghem. Er ist Lehrer in der Erwachsenenbildung.
Lesen Sie hier die ersten Kapitel aus Die Geschichte von Nicky! Ausschließlich zum Gebrauch als Leseprobe. Alle Rechte vorbehalten.Zubehör: Lesebegleitheft"
Die Geschichte von Reda,https://einfachebuecher.de/media/8e/f4/75/1654876225/9783948856007_m.jpg,"Die Frau läuft vorbei.
Dieses Mal lächelt sie nicht.
Sie läuft noch schneller.
Hat sie Angst vor ihm?
Reda steht auf.
Er will nach Hause.
Da hört er ein „Au!“.
Reda will eine andere Arbeit. Richtige Arbeit. Mit Vertrag.
Aber das geht nicht. Denn er hat keine Papiere.
Reda weiß nicht, was er tun soll.
Bis ein Spaziergang alles ändert.
Die Geschichte von Reda ist Teil unserer Buchreihe Mitten im Leben in Leichter Sprache. Diese Serie wurde für Lese-Anfänger entwickelt. Autor ist Johan van Caeneghem. Er ist Lehrer in der Erwachsenenbildung.
Lesen Sie hier die ersten Kapitel aus Die Geschichte von Reda! Ausschließlich zum Gebrauch als Leseprobe. Alle Rechte vorbehalten.
Zubehör: Lesebegleitheft"
Die Geschichte von Sam,https://einfachebuecher.de/media/8c/fd/35/1654876202/Die_Geschichte_von_Sam_-_cover_lowres_m.jpg,"Sam wird wach.
Er hört etwas.
Die Klingel!
Er guckt auf die Uhr.
Es ist beinah drei Uhr nachts.
Ist etwas passiert?
Mit Sarah?
Ein Unfall?
Sam ist alleine zuhause. Mitten in der Nacht klingelt es. Ein Mann steht vor der Tür. Was will er von Sam?
Die Geschichte von Sam ist Teil unserer Bücherreihe in Leichter Sprache. Diese Serie wurde für Lese-Anfänger entwickelt. Autor ist der Niederländer Johan van Caeneghem. Er ist Lehrer in der Erwachsenenbildung.
Lesen Sie hier die ersten Kapitel aus Die Geschichte von Sam! Ausschließlich zum Gebrauch als Leseprobe. Alle Rechte vorbehalten.Zubehör: Lesebegleitheft"
Die Geschichte von Tom,https://einfachebuecher.de/media/f9/23/65/1654876196/Die_Geschichte_von_Tom_-_lowres_m.jpg,"Tom wacht auf.
Er liegt auf den Rücken.
Neben seinem Auto.
Was ist passiert?
Sein Auto ist kaputt!
Er steht auf.
Sein Rücken tut weh.
Wo ist er?
Wer ist er?
Er weiß es nicht. Nach einem Unfall kann Tom sich an nichts mehr erinnern. Wie findet er den Weg nach Hause?
Die Geschichte von Tom ist Teil unserer Bücherreihe Mitten im Leben in Leichter Sprache. Diese Serie wurde für Lese-Anfänger entwickelt. Autor ist Johan van Caeneghem. Er ist Lehrer in der Erwachsenenbildung.Lesen Sie hier die ersten Kapitel aus Die Geschichte von Tom! Ausschließlich zum Gebrauch als Leseprobe. Alle Rechte vorbehalten.Zubehör: Lesebegleitheft"
Die Geschichte von Zen,https://einfachebuecher.de/media/99/cb/30/1654876192/Die_Geschichte_von_Zen_Front_m.jpg,"Zen ist neu in Deutschland. Er ist geflüchtet. Ganz allein, ohne seine Eltern.
Zen erzählt über seine Heimat, seine Schulzeit, seine Erlebnisse auf der Flucht
und sein neues Leben in Deutschland. Er schildert, wie er Deutschland wahrnimmt.
Und welche Träume er hat.
Die Geschichte von Zen ist der Auftakt zu einer multimedialen Serie über
unbegleitete minderjährige Flüchtlinge in Deutschland: Woher kommen sie?
Wer sind sie? Wie sind sie nach Deutschland gekommen? Und warum sind sie
allein? Über diese Fragen sprechen sie und erzählen auf sehr persönliche Weise
ihre Geschichte.
Zu jedem Kapitel gibt es Übungen und Aufgaben in zwei Schwierigkeitsstufen.
Sie helfen beim Verständnis und erleichtern den Zugang.
Lesen, Hörverstehen, Aussprache und Wortschatz können Sie mit Buch
und Audiodatei trainieren.
Dr. Alexis Feldmeier García ist wissenschaftlicher Mitarbeiter in der
Abteilung Sprachdidaktik am Germanistischen Institut der Westfälischen
Wilhelms-Universität Münster.Lesen Sie hier die ersten Kapitel aus Die Geschichte von Zen! Ausschließlich zum Gebrauch als Leseprobe. Alle Rechte vorbehalten.Zubehör: Lesebegleitheft

Audiodateien - Die Geschichte von Zen:Zen InhaltsverzeichnisZen EinleitungZen 1Herkunft

Zen 1Herkunft langsamZen 2SchulzeitZen 2Schulzeit langsamZen 3KricketZen 3Kricket langsamZen 4PakistanZen 4Pakistan langsamZen 5RusslandZen 5Russland langsamZen 6BielefeldZen 6Bielefeld langsamZen 7DeutschlandZen 7Deutschland langsam"
